inputID,input,task,source
qa1,what's something that's really bad for the body but people keep doing it?,question answering,https://www.reddit.com/r/AskReddit/
qa2,What is 22 years too old for?,question answering,https://www.reddit.com/r/AskReddit/
qa3,What's a dead giveaway that someone is a bad person?,question answering,https://www.reddit.com/r/AskReddit/
qa4,What is 25 years too old for?,question answering,https://www.reddit.com/r/AskReddit/
qa5,What is something that you WOULD wish on your worst enemy?,question answering,https://www.reddit.com/r/AskReddit/